{
    "operators": 2,
    "drawer_capacities": [
        {
            "box": "A",
            "capacity": 40
        },
        {
            "box": "B",
            "capacity": 40
        },
        {
            "box": "C",
            "capacity": 40
        },
        {
            "box": "D",
            "capacity": 40
        },
        {
            "box": "E",
            "capacity": 40
        },
        {
            "box": "F",
            "capacity": 40
        },
        {
            "box": "G",
            "capacity": 40
        },
        {
            "box": "H",
            "capacity": 40
        }
    ],
    "replenish_duration": 300,
    "box_construction_duration": 60,
    "box_filling_durations": [
        {
            "box": "A",
            "filling_duration": 120
        },
        {
            "box": "B",
            "filling_duration": 120
        },
        {
            "box": "C",
            "filling_duration": 120
        },
        {
            "box": "D",
            "filling_duration": 120
        },
        {
            "box": "E",
            "filling_duration": 120
        },
        {
            "box": "F",
            "filling_duration": 120
        },
        {
            "box": "G",
            "filling_duration": 120
        },
        {
            "box": "H",
            "filling_duration": 120
        }
    ]
}